{
  "schema_version": "1.0.0",
  "record_type": "evidence_review",
  "id": "evidence-review-maintenance-signal-control-operational-boundary-r1",
  "name": "Operational Boundary Review for Maintenance Signal Control Bundle",
  "candidate_bundle_id": "maintenance-signal-control-baseline-2026-06-01",
  "bundle_revision_number": 1,
  "review_round": 1,
  "review_lane": "operational_boundary",
  "reviewer_kind": "agent",
  "reviewer_id": "codex-agent",
  "skill_name": "evidence-review",
  "status": "complete",
  "verdict": "accept",
  "blocking": false,
  "summary": "The records clearly bound the baseline to documentation-level Scorecard check semantics and leave repository, release, issue, maintainer, and support-window review to later project-specific bundles.",
  "reviewed_change_ids": [
    "create-scorecard-maintenance-source",
    "create-scorecard-maintenance-artifact",
    "create-scorecard-maintenance-finding",
    "create-maintenance-signal-claim"
  ],
  "findings": [],
  "created_at": "2026-06-01T21:10:00Z",
  "updated_at": "2026-06-01T21:10:00Z"
}
