{
  "schema_version": "1.0.0",
  "record_type": "evidence_review",
  "id": "evidence-review-release-provenance-control-risk-framing-r1",
  "name": "Risk Framing Review For Release Provenance Control Baseline",
  "candidate_bundle_id": "release-provenance-control-baseline-2026-06-01",
  "bundle_revision_number": 1,
  "review_round": 1,
  "review_lane": "risk_framing",
  "reviewer_kind": "agent",
  "skill_name": "evidence-review",
  "status": "complete",
  "verdict": "accept",
  "blocking": false,
  "summary": "The staged claim frames SLSA provenance as a control baseline and avoids asserting security assurance for any specific release or project.",
  "reviewed_change_ids": [
    "create-slsa-provenance-source",
    "create-slsa-provenance-artifact",
    "create-slsa-provenance-finding",
    "create-release-provenance-claim"
  ],
  "findings": [],
  "created_at": "2026-06-01T19:36:00Z",
  "updated_at": "2026-06-01T19:36:00Z"
}
