{
  "schema_version": "1.0.0",
  "record_type": "evidence_review",
  "id": "evidence-review-archive-question-source-fidelity-r1",
  "name": "Source Fidelity Review For Archive Question Bundle",
  "candidate_bundle_id": "archive-question-baseline-2026-05-31",
  "bundle_revision_number": 1,
  "review_round": 1,
  "review_lane": "source_fidelity",
  "reviewer_kind": "agent",
  "skill_name": "evidence-review",
  "status": "complete",
  "verdict": "accept",
  "blocking": false,
  "summary": "The fixture archive source, artifact, finding, and claim records use matching IDs and intentionally synthetic metadata.",
  "reviewed_change_ids": [
    "create-archive-source",
    "create-archive-artifact",
    "create-archive-finding",
    "create-archive-claim"
  ],
  "findings": [],
  "created_at": "2026-05-31T13:05:00Z",
  "updated_at": "2026-05-31T13:05:00Z"
}
