{
  "schema_version": "1.0.0",
  "record_type": "evidence_review",
  "id": "evidence-review-maintenance-signal-control-risk-framing-r1",
  "name": "Risk Framing Review for Maintenance Signal Control Bundle",
  "candidate_bundle_id": "maintenance-signal-control-baseline-2026-06-01",
  "bundle_revision_number": 1,
  "review_round": 1,
  "review_lane": "risk_framing",
  "reviewer_kind": "agent",
  "reviewer_id": "codex-agent",
  "skill_name": "evidence-review",
  "status": "complete",
  "verdict": "accept",
  "blocking": false,
  "summary": "The claim separates observable maintenance signals from stronger assurance language and avoids implying code quality, responsiveness, or future support for any specific project.",
  "reviewed_change_ids": [
    "create-scorecard-maintenance-source",
    "create-scorecard-maintenance-artifact",
    "create-scorecard-maintenance-finding",
    "create-maintenance-signal-claim"
  ],
  "findings": [],
  "created_at": "2026-06-01T21:09:40Z",
  "updated_at": "2026-06-01T21:09:40Z"
}
