{
  "schema_version": "1.0.0",
  "record_type": "evidence_review",
  "id": "evidence-review-ssr-generation-methods-method-classification-r1",
  "name": "Method Classification review for Ssr Generation Methods bundle",
  "candidate_bundle_id": "ssr-generation-methods-baseline-2026-06-02",
  "bundle_revision_number": 1,
  "review_round": 1,
  "review_lane": "method_classification",
  "reviewer_kind": "agent",
  "status": "complete",
  "verdict": "accept",
  "blocking": false,
  "summary": "Accepted. The method labels are separable and appropriately bounded: knowledge-profile and representative-example LLM generation, learner-profile/memory/action generative agents, example-quality-error conditioned Copilot prompting, non-LLM CASE corruption, and prompt-strategy comparison for simulated essays.",
  "reviewed_change_ids": [
    "create-ssr-generation-methods-search-2026-06-02",
    "create-ipci-knowledge-profiles-response-generation-source",
    "create-agent4edu-learner-response-generation-source",
    "create-watts-scientific-argumentation-chatbot-source",
    "create-ipci-profile-based-generation-artifact",
    "create-agent4edu-generative-agent-artifact",
    "create-watts-copilot-synthetic-inputs-artifact",
    "create-yoo-case-corruption-generation-artifact",
    "create-wolfe-prompt-strategy-generation-artifact",
    "create-ipci-profile-based-generation-finding",
    "create-agent4edu-generative-agent-finding",
    "create-watts-copilot-synthetic-inputs-finding",
    "create-yoo-case-corruption-generation-finding",
    "create-wolfe-prompt-strategy-generation-finding",
    "create-ssr-generation-methods-baseline-claim"
  ],
  "findings": [],
  "skill_name": "evidence-review",
  "reviewer_id": "codex-agent",
  "created_at": "2026-06-02T13:25:49.396Z",
  "updated_at": "2026-06-02T13:25:49.396Z"
}
