{
  "schema_version": "1.0.0",
  "record_type": "evidence_review",
  "id": "evidence-review-ssr-validity-conditions-controlled-comparisons-update-method-classification-r1",
  "name": "Method Classification review for Validity Conditions and Controlled Comparison Update bundle",
  "candidate_bundle_id": "ssr-validity-conditions-controlled-comparisons-update-2026-06-03",
  "bundle_revision_number": 1,
  "review_round": 1,
  "review_lane": "method_classification",
  "reviewer_kind": "agent",
  "skill_name": "evidence-review",
  "reviewer_id": "codex-agent",
  "status": "complete",
  "verdict": "accept",
  "blocking": false,
  "summary": "Accepted. The bundle classifies the new studies as model/workflow and evaluation-method evidence, not as a generic model leaderboard. Prompt-only, fine-tuning, DPO, multi-agent, IRT-aligned, and cognitive-prototype workflows are separated where the papers separate them.",
  "reviewed_change_ids": [
    "create-nguyen-cao-source",
    "create-nguyen-cao-artifact",
    "create-nguyen-cao-finding",
    "create-cao-nguyen-source",
    "create-cao-nguyen-artifact",
    "create-cao-nguyen-finding",
    "create-smart-source",
    "create-smart-artifact",
    "create-smart-finding",
    "create-wu-source",
    "create-wu-artifact",
    "create-wu-finding",
    "create-validity-conditions-search-protocol"
  ],
  "findings": [
    {
      "finding_id": "workflow-effect-classification-is-bounded",
      "severity": "note",
      "category": "method_misclassification",
      "claim_or_issue": "The proposed synthesis frames model choice as model/workflow sensitivity rather than a cross-task ranking of model families.",
      "why_it_matters": "The included papers vary task, prompt, comparator, training, and evaluation design, so simple model rankings would overstate the evidence.",
      "recommended_action": "Keep the model/workflow wording in future literature-review revisions.",
      "resolution_status": "closed",
      "applies_to_change_id": "create-cao-nguyen-finding"
    }
  ],
  "created_at": "2026-06-03T19:07:00Z",
  "updated_at": "2026-06-03T19:07:00Z"
}
