{
  "schema_version": "1.0.0",
  "record_type": "evidence_review",
  "id": "evidence-review-ssr-validity-conditions-controlled-comparisons-update-applicability-boundary-r1",
  "name": "Applicability Boundary review for Validity Conditions and Controlled Comparison Update bundle",
  "candidate_bundle_id": "ssr-validity-conditions-controlled-comparisons-update-2026-06-03",
  "bundle_revision_number": 1,
  "review_round": 1,
  "review_lane": "applicability_boundary",
  "reviewer_kind": "agent",
  "skill_name": "evidence-review",
  "reviewer_id": "codex-agent",
  "status": "complete",
  "verdict": "accept",
  "blocking": false,
  "summary": "Accepted. The staged applicability facets keep Nguyen and Cao under formative-feedback/instructional support, Cao et al. and Wu et al. under research/development, and SMART under research/development plus calibration/development. None of the records are mapped as high-stakes operational validation.",
  "reviewed_change_ids": [
    "create-nguyen-cao-source",
    "create-nguyen-cao-artifact",
    "create-nguyen-cao-finding",
    "create-cao-nguyen-source",
    "create-cao-nguyen-artifact",
    "create-cao-nguyen-finding",
    "create-smart-source",
    "create-smart-artifact",
    "create-smart-finding",
    "create-wu-source",
    "create-wu-artifact",
    "create-wu-finding",
    "create-validity-conditions-search-protocol"
  ],
  "findings": [
    {
      "finding_id": "applicability-facets-preserve-low-stakes-and-developmental-boundaries",
      "severity": "note",
      "category": "endpoint_boundary",
      "claim_or_issue": "The staged records map teacher-learning, instructional-planning, programming simulation, and item-development evidence to controlled low/no-consequence or development-facing facets.",
      "why_it_matters": "Without this boundary, research/development realism evidence could be misread as high-stakes scoring validation evidence.",
      "recommended_action": "Keep the current assessment_purpose, decision_consequence, operational_use, and limitations fields.",
      "resolution_status": "closed",
      "applies_to_change_id": "create-validity-conditions-search-protocol"
    }
  ],
  "created_at": "2026-06-03T19:09:00Z",
  "updated_at": "2026-06-03T19:09:00Z"
}
