{
  "schema_version": "1.0.0",
  "record_type": "evidence_review",
  "id": "evidence-review-release-provenance-control-control-fit-r1",
  "name": "Control Fit Review For Release Provenance Control Baseline",
  "candidate_bundle_id": "release-provenance-control-baseline-2026-06-01",
  "bundle_revision_number": 1,
  "review_round": 1,
  "review_lane": "control_fit",
  "reviewer_kind": "agent",
  "skill_name": "evidence-review",
  "status": "complete",
  "verdict": "accept",
  "blocking": false,
  "summary": "The staged records are scoped to release provenance and do not drift into dependency exposure or maintenance-signal controls.",
  "reviewed_change_ids": [
    "create-slsa-provenance-source",
    "create-slsa-provenance-artifact",
    "create-slsa-provenance-finding",
    "create-release-provenance-claim"
  ],
  "findings": [],
  "created_at": "2026-06-01T19:35:00Z",
  "updated_at": "2026-06-01T19:35:00Z"
}
