{
  "schema_version": "1.0.0",
  "record_type": "evidence_review",
  "id": "evidence-review-ssr-scoring-validation-use-synthesis-overreach-r1",
  "name": "Synthesis Overreach review for ssr-scoring-validation-use bundle",
  "candidate_bundle_id": "ssr-scoring-validation-use-baseline-2026-06-02",
  "bundle_revision_number": 1,
  "review_round": 1,
  "review_lane": "synthesis_overreach",
  "reviewer_kind": "agent",
  "reviewer_id": "codex-agent",
  "skill_name": "evidence-review",
  "status": "complete",
  "verdict": "accept",
  "blocking": false,
  "summary": "Accepted. The staged claim uses medium confidence, distinguishes direct support from boundary evidence, and states limitations around targeted search scope, study type, item type, model, prompt, and validation generalization.",
  "reviewed_change_ids": [
    "create-ssr-scoring-validation-search-protocol",
    "create-frohn-llm-cr-live-scoring-source",
    "create-walsh-sjt-automated-scoring-source",
    "create-yoo-dress-rubric-aes-source",
    "create-wolfe-calibrating-realistic-essays-source",
    "create-frohn-validation-framework-artifact",
    "create-walsh-fairness-stress-test-artifact",
    "create-yoo-dress-training-boundary-artifact",
    "create-wolfe-realistic-essays-artifact",
    "create-frohn-validation-framework-finding",
    "create-walsh-fairness-stress-test-finding",
    "create-yoo-training-boundary-finding",
    "create-wolfe-realistic-essays-finding",
    "create-ssr-scoring-validation-use-claim"
  ],
  "findings": [],
  "created_at": "2026-06-02T12:27:00Z",
  "updated_at": "2026-06-02T12:27:00Z"
}
