{
  "schema_version": "1.0.0",
  "record_type": "evidence_review",
  "id": "evidence-review-ssr-acceptable-scoring-uses-operational-augmentation-update-construct-mapping-r1",
  "name": "Construct Mapping review for Acceptable Use Operational Training Augmentation Update bundle",
  "candidate_bundle_id": "ssr-acceptable-scoring-uses-operational-augmentation-update-2026-06-03",
  "bundle_revision_number": 1,
  "review_round": 1,
  "review_lane": "construct_mapping",
  "reviewer_kind": "agent",
  "skill_name": "evidence-review",
  "reviewer_id": "codex-agent",
  "status": "complete",
  "verdict": "accept",
  "blocking": false,
  "summary": "Accepted. The staged claim maps each source to the correct acceptable-use construct: operational training augmentation for New Mexico, formative hybrid augmentation for Rezayi, classroom rare-category augmentation for Djagba, and high-stakes detection or stress testing for Wang.",
  "reviewed_change_ids": [
    "update-acceptable-scoring-uses-claim"
  ],
  "findings": [
    {
      "finding_id": "wang-classified-as-detection-not-scoring-validation",
      "severity": "note",
      "category": "construct_boundary",
      "claim_or_issue": "Wang et al. belongs in a detection and validity-protection stress-test category, not a scoring-agreement or scorer-validation category.",
      "why_it_matters": "A constructed off-topic detection set is useful evidence for tool hardening but should not be read as validation of scoring on regular on-topic responses.",
      "recommended_action": "Retain the boundary-condition support role for Wang et al.",
      "resolution_status": "closed",
      "applies_to_change_id": "update-acceptable-scoring-uses-claim"
    }
  ],
  "created_at": "2026-06-03T12:06:30Z",
  "updated_at": "2026-06-03T12:06:30Z"
}
