{
  "schema_version": "1.0.0",
  "record_type": "evidence_review",
  "id": "evidence-review-archive-question-scope-fit-r1",
  "name": "Scope Fit Review For Archive Question Bundle",
  "candidate_bundle_id": "archive-question-baseline-2026-05-31",
  "bundle_revision_number": 1,
  "review_round": 1,
  "review_lane": "scope_fit",
  "reviewer_kind": "agent",
  "skill_name": "evidence-review",
  "status": "complete",
  "verdict": "accept",
  "blocking": false,
  "summary": "The staged archive claim is scoped to archive-question and does not depend on topic-specific assumptions.",
  "reviewed_change_ids": [
    "create-archive-source",
    "create-archive-artifact",
    "create-archive-finding",
    "create-archive-claim"
  ],
  "findings": [],
  "created_at": "2026-05-31T13:06:00Z",
  "updated_at": "2026-05-31T13:06:00Z"
}
